[
  {
    "id": "demo-photoszene-beispiel",
    "name": "[Demo] Photoszene Beispielstadt e.V.",
    "type": "association",
    "city": "Köln",
    "website": "https://example.org/photoszene"
  },
  {
    "id": "demo-festival-ohne-programm",
    "name": "[Demo] Festival ohne Programm",
    "type": "festival",
    "city": "Düsseldorf"
  }
]
